{
  "external_delivery_id": "D-12345",
  "event_type": "DASHER_CONFIRMED",
  "delivery_status": "active",
  "fee": 42,
  "currency": "USD",
  "tip": 42,
  "order_value": 42,
  "pickup_address": "901 Market St, San Francisco, CA 94105",
  "pickup_business_name": "Acme Pickup Store",
  "pickup_time_estimated": "2026-06-02T14:30:00Z",
  "pickup_time_actual": "2026-06-02T14:30:00Z",
  "dropoff_address": "901 Market St, San Francisco, CA 94105",
  "dropoff_time_estimated": "2026-06-02T14:30:00Z",
  "dropoff_time_actual": "2026-06-02T14:30:00Z",
  "dropoff_contact_given_name": "Acme Pickup Store",
  "dropoff_contact_family_name": "Acme Pickup Store",
  "dasher_id": 42,
  "dasher_name": "Acme Pickup Store",
  "dasher_phone_number": "+15555551234",
  "dasher_location_lat": 37.422,
  "dasher_location_lng": -122.084,
  "tracking_url": "https://example.com/path/abc123",
  "cancellation_reason": "37.422",
  "force_batch_id": "D-12345",
  "contains_alcohol": true,
  "created_at": "2026-06-02T14:30:00Z",
  "updated_at": "2026-06-02T14:30:00Z"
}
